{
 "schema": "c4-module3-feed-1",
 "producer": "Component 4 - crowd and capacity forecasting (ST-GNN + Cifuentes)",
 "park": "horton_plains",
 "site": "Horton Plains National Park",
 "forecast_date": "2026-10-21",
 "generated_at": "2026-10-20T23:40:33",
 "model": "stgnn",
 "open_hours": [
  6,
  7,
  8,
  9,
  10,
  11,
  12,
  13,
  14,
  15,
  16,
  17
 ],
 "busy_utilisation": 0.8,
 "safe_visitors_per_day": 690,
 "expected_visitors": 357,
 "segments": [
  {
   "segment_id": 0,
   "trail": "main",
   "place": null,
   "length_m": 294,
   "people_hourly": [
    0.0,
    0.0,
    0.0,
    0.0,
    0.0,
    0.0,
    0.9,
    1.0,
    2.5,
    8.8,
    8.7,
    2.9,
    1.0,
    0.7,
    0.4,
    0.2,
    0.0,
    0.0,
    0.0,
    0.0,
    0.0,
    0.0,
    0.0,
    0.0
   ],
   "capacity_at_once": 49.0,
   "status": "ok",
   "peak_hour": 9,
   "avoid_hours": [],
   "safe_visits_per_day": 1983
  },
  {
   "segment_id": 1,
   "trail": "main",
   "place": null,
   "length_m": 294,
   "people_hourly": [
    0.0,
    0.0,
    0.0,
    0.0,
    0.0,
    0.0,
    1.0,
    1.2,
    2.9,
    7.9,
    7.7,
    2.6,
    1.2,
    0.9,
    0.5,
    0.2,
    0.0,
    0.0,
    0.0,
    0.0,
    0.0,
    0.0,
    0.0,
    0.0
   ],
   "capacity_at_once": 49.0,
   "status": "ok",
   "peak_hour": 9,
   "avoid_hours": [],
   "safe_visits_per_day": 1685
  },
  {
   "segment_id": 2,
   "trail": "main",
   "place": null,
   "length_m": 294,
   "people_hourly": [
    0.0,
    0.0,
    0.0,
    0.0,
    0.0,
    0.0,
    1.0,
    1.2,
    2.9,
    7.4,
    6.7,
    1.9,
    1.1,
    0.8,
    0.4,
    0.2,
    0.0,
    0.0,
    0.0,
    0.0,
    0.0,
    0.0,
    0.0,
    0.0
   ],
   "capacity_at_once": 49.0,
   "status": "ok",
   "peak_hour": 9,
   "avoid_hours": [],
   "safe_visits_per_day": 1913
  },
  {
   "segment_id": 3,
   "trail": "main",
   "place": null,
   "length_m": 294,
   "people_hourly": [
    0.0,
    0.0,
    0.0,
    0.0,
    0.0,
    0.0,
    0.9,
    1.2,
    2.7,
    7.8,
    5.0,
    1.8,
    1.1,
    0.9,
    0.4,
    0.1,
    0.0,
    0.0,
    0.0,
    0.0,
    0.0,
    0.0,
    0.0,
    0.0
   ],
   "capacity_at_once": 49.0,
   "status": "ok",
   "peak_hour": 9,
   "avoid_hours": [],
   "safe_visits_per_day": 1805
  },
  {
   "segment_id": 4,
   "trail": "main",
   "place": null,
   "length_m": 294,
   "people_hourly": [
    0.0,
    0.0,
    0.0,
    0.0,
    0.0,
    0.0,
    0.9,
    1.8,
    4.3,
    9.4,
    4.9,
    1.4,
    1.1,
    0.8,
    0.3,
    0.1,
    0.0,
    0.0,
    0.0,
    0.0,
    0.0,
    0.0,
    0.0,
    0.0
   ],
   "capacity_at_once": 49.0,
   "status": "ok",
   "peak_hour": 9,
   "avoid_hours": [],
   "safe_visits_per_day": 1805
  },
  {
   "segment_id": 5,
   "trail": "main",
   "place": null,
   "length_m": 294,
   "people_hourly": [
    0.0,
    0.0,
    0.0,
    0.0,
    0.0,
    0.0,
    0.9,
    1.6,
    4.9,
    8.9,
    3.7,
    1.2,
    1.0,
    0.8,
    0.3,
    0.1,
    0.0,
    0.0,
    0.0,
    0.0,
    0.0,
    0.0,
    0.0,
    0.0
   ],
   "capacity_at_once": 49.0,
   "status": "ok",
   "peak_hour": 9,
   "avoid_hours": [],
   "safe_visits_per_day": 1774
  },
  {
   "segment_id": 6,
   "trail": "main",
   "place": null,
   "length_m": 294,
   "people_hourly": [
    0.0,
    0.0,
    0.0,
    0.0,
    0.0,
    0.0,
    0.5,
    1.7,
    6.9,
    11.5,
    4.7,
    1.4,
    1.2,
    0.9,
    0.3,
    0.0,
    0.0,
    0.0,
    0.0,
    0.0,
    0.0,
    0.0,
    0.0,
    0.0
   ],
   "capacity_at_once": 49.0,
   "status": "ok",
   "peak_hour": 9,
   "avoid_hours": [],
   "safe_visits_per_day": 2041
  },
  {
   "segment_id": 7,
   "trail": "main",
   "place": null,
   "length_m": 293,
   "people_hourly": [
    0.0,
    0.0,
    0.0,
    0.0,
    0.0,
    0.0,
    11.1,
    8.5,
    2.7,
    8.2,
    9.8,
    3.2,
    2.0,
    0.5,
    0.2,
    0.1,
    0.0,
    0.0,
    0.0,
    0.0,
    0.0,
    0.0,
    0.0,
    0.0
   ],
   "capacity_at_once": 48.8,
   "status": "ok",
   "peak_hour": 6,
   "avoid_hours": [],
   "safe_visits_per_day": 1845
  },
  {
   "segment_id": 8,
   "trail": "main",
   "place": null,
   "length_m": 293,
   "people_hourly": [
    0.0,
    0.0,
    0.0,
    0.0,
    0.0,
    0.0,
    11.2,
    7.8,
    2.8,
    8.1,
    9.4,
    3.5,
    2.2,
    0.7,
    0.3,
    0.1,
    0.0,
    0.0,
    0.0,
    0.0,
    0.0,
    0.0,
    0.0,
    0.0
   ],
   "capacity_at_once": 48.8,
   "status": "ok",
   "peak_hour": 6,
   "avoid_hours": [],
   "safe_visits_per_day": 1688
  },
  {
   "segment_id": 9,
   "trail": "main",
   "place": null,
   "length_m": 296,
   "people_hourly": [
    0.0,
    0.0,
    0.0,
    0.0,
    0.0,
    0.0,
    9.1,
    9.6,
    2.7,
    2.4,
    1.7,
    0.8,
    0.2,
    0.0,
    0.0,
    0.0,
    0.0,
    0.0,
    0.0,
    0.0,
    0.0,
    0.0,
    0.0,
    0.0
   ],
   "capacity_at_once": 49.2,
   "status": "ok",
   "peak_hour": 7,
   "avoid_hours": [],
   "safe_visits_per_day": 1496
  },
  {
   "segment_id": 10,
   "trail": "main",
   "place": null,
   "length_m": 296,
   "people_hourly": [
    0.0,
    0.0,
    0.0,
    0.0,
    0.0,
    0.0,
    7.7,
    9.3,
    3.2,
    2.5,
    1.8,
    0.9,
    0.2,
    0.0,
    0.0,
    0.0,
    0.0,
    0.0,
    0.0,
    0.0,
    0.0,
    0.0,
    0.0,
    0.0
   ],
   "capacity_at_once": 49.2,
   "status": "ok",
   "peak_hour": 7,
   "avoid_hours": [],
   "safe_visits_per_day": 1652
  },
  {
   "segment_id": 11,
   "trail": "main",
   "place": null,
   "length_m": 296,
   "people_hourly": [
    0.0,
    0.0,
    0.0,
    0.0,
    0.0,
    0.0,
    6.2,
    8.7,
    3.2,
    2.5,
    1.9,
    1.0,
    0.2,
    0.0,
    0.0,
    0.0,
    0.0,
    0.0,
    0.0,
    0.0,
    0.0,
    0.0,
    0.0,
    0.0
   ],
   "capacity_at_once": 49.2,
   "status": "ok",
   "peak_hour": 7,
   "avoid_hours": [],
   "safe_visits_per_day": 1796
  },
  {
   "segment_id": 12,
   "trail": "main",
   "place": null,
   "length_m": 296,
   "people_hourly": [
    0.0,
    0.0,
    0.0,
    0.0,
    0.0,
    0.0,
    4.0,
    8.0,
    3.0,
    2.6,
    2.0,
    1.1,
    0.2,
    0.0,
    0.0,
    0.0,
    0.0,
    0.0,
    0.0,
    0.0,
    0.0,
    0.0,
    0.0,
    0.0
   ],
   "capacity_at_once": 49.2,
   "status": "ok",
   "peak_hour": 7,
   "avoid_hours": [],
   "safe_visits_per_day": 1962
  },
  {
   "segment_id": 13,
   "trail": "main",
   "place": null,
   "length_m": 296,
   "people_hourly": [
    0.0,
    0.0,
    0.0,
    0.0,
    0.0,
    0.0,
    3.1,
    7.7,
    4.6,
    2.7,
    2.0,
    1.1,
    0.3,
    0.1,
    0.0,
    0.0,
    0.0,
    0.0,
    0.0,
    0.0,
    0.0,
    0.0,
    0.0,
    0.0
   ],
   "capacity_at_once": 49.2,
   "status": "ok",
   "peak_hour": 7,
   "avoid_hours": [],
   "safe_visits_per_day": 1906
  },
  {
   "segment_id": 14,
   "trail": "main",
   "place": "Mini World's End",
   "length_m": 296,
   "people_hourly": [
    0.0,
    0.0,
    0.0,
    0.0,
    0.0,
    0.0,
    11.2,
    24.8,
    17.3,
    5.9,
    5.1,
    3.7,
    2.4,
    1.0,
    0.1,
    0.0,
    0.0,
    0.0,
    0.0,
    0.0,
    0.0,
    0.0,
    0.0,
    0.0
   ],
   "capacity_at_once": 49.2,
   "status": "ok",
   "peak_hour": 7,
   "avoid_hours": [],
   "safe_visits_per_day": 637
  },
  {
   "segment_id": 15,
   "trail": "main",
   "place": null,
   "length_m": 296,
   "people_hourly": [
    0.0,
    0.0,
    0.0,
    0.0,
    0.0,
    0.0,
    3.6,
    12.0,
    9.7,
    3.0,
    2.4,
    1.5,
    0.4,
    0.2,
    0.0,
    0.0,
    0.0,
    0.0,
    0.0,
    0.0,
    0.0,
    0.0,
    0.0,
    0.0
   ],
   "capacity_at_once": 49.2,
   "status": "ok",
   "peak_hour": 7,
   "avoid_hours": [],
   "safe_visits_per_day": 1300
  },
  {
   "segment_id": 16,
   "trail": "main",
   "place": null,
   "length_m": 296,
   "people_hourly": [
    0.0,
    0.0,
    0.0,
    0.0,
    0.0,
    0.0,
    0.6,
    10.8,
    8.6,
    3.4,
    1.4,
    1.1,
    0.5,
    0.2,
    0.0,
    0.0,
    0.0,
    0.0,
    0.0,
    0.0,
    0.0,
    0.0,
    0.0,
    0.0
   ],
   "capacity_at_once": 49.2,
   "status": "ok",
   "peak_hour": 7,
   "avoid_hours": [],
   "safe_visits_per_day": 1618
  },
  {
   "segment_id": 17,
   "trail": "main",
   "place": null,
   "length_m": 296,
   "people_hourly": [
    0.0,
    0.0,
    0.0,
    0.0,
    0.0,
    0.0,
    0.1,
    9.1,
    8.4,
    3.2,
    1.3,
    0.9,
    0.5,
    0.2,
    0.0,
    0.0,
    0.0,
    0.0,
    0.0,
    0.0,
    0.0,
    0.0,
    0.0,
    0.0
   ],
   "capacity_at_once": 49.2,
   "status": "ok",
   "peak_hour": 7,
   "avoid_hours": [],
   "safe_visits_per_day": 1812
  },
  {
   "segment_id": 18,
   "trail": "main",
   "place": null,
   "length_m": 296,
   "people_hourly": [
    0.0,
    0.0,
    0.0,
    0.0,
    0.0,
    0.0,
    0.0,
    11.7,
    13.2,
    4.5,
    1.7,
    1.5,
    0.8,
    0.2,
    0.0,
    0.0,
    0.0,
    0.0,
    0.0,
    0.0,
    0.0,
    0.0,
    0.0,
    0.0
   ],
   "capacity_at_once": 49.2,
   "status": "ok",
   "peak_hour": 8,
   "avoid_hours": [],
   "safe_visits_per_day": 1360
  },
  {
   "segment_id": 19,
   "trail": "main",
   "place": "World's End",
   "length_m": 296,
   "people_hourly": [
    0.0,
    0.0,
    0.0,
    0.0,
    0.0,
    0.0,
    0.2,
    33.0,
    62.0,
    26.5,
    6.9,
    5.6,
    4.1,
    2.3,
    0.6,
    0.0,
    0.0,
    0.0,
    0.0,
    0.0,
    0.0,
    0.0,
    0.0,
    0.0
   ],
   "capacity_at_once": 49.2,
   "status": "bottleneck",
   "peak_hour": 8,
   "avoid_hours": [
    8
   ],
   "safe_visits_per_day": 283
  },
  {
   "segment_id": 20,
   "trail": "main",
   "place": null,
   "length_m": 296,
   "people_hourly": [
    0.0,
    0.0,
    0.0,
    0.0,
    0.0,
    0.0,
    0.0,
    5.3,
    9.6,
    6.3,
    0.9,
    0.8,
    0.6,
    0.3,
    0.1,
    0.0,
    0.0,
    0.0,
    0.0,
    0.0,
    0.0,
    0.0,
    0.0,
    0.0
   ],
   "capacity_at_once": 49.2,
   "status": "ok",
   "peak_hour": 8,
   "avoid_hours": [],
   "safe_visits_per_day": 2011
  },
  {
   "segment_id": 21,